id,size,forks,open_issues,subscribers_count,stargazers_count,language_dictionary,owner_type,url,pushed_at,topics,description
3249758,124,24,14,9,249,"{'python': 97708, 'shell': 5475}",User,https://api.github.com/repos/ojii/pymaging,2013-09-08T13:14:04Z,[],pure python imaging library with python     and support
6650556,309,18,1,25,249,{'objective-c': 24686},User,https://api.github.com/repos/RolandasRazma/RRAutoLayout,2013-07-10T07:15:40Z,[],ios autolayout backport to ios
4935611,2384,11,14,19,248,"{'coffeescript': 520, 'javascript': 115746}",User,https://api.github.com/repos/karthikv/nodefront,2013-02-03T21:53:39Z,[],a node js powered rapid front end development utility
10019217,168,28,5,20,248,"{'css': 1600, 'javascript': 2706}",User,https://api.github.com/repos/mixinmax/jquery.swatches,2013-09-09T03:16:35Z,[],a jquery plugin that turns a one line div into a sweet color swatch
1136112,167,39,2,10,247,"{'c': 2531, 'c++': 2214, 'objective-c': 53813}",User,https://api.github.com/repos/tylerneylon/moriarty,2013-04-01T21:14:49Z,[],a collection of useful objective c and ios classes
12339565,5997,31,1,15,247,"{'css': 40885, 'javascript': 1099014, 'shell': 360}",User,https://api.github.com/repos/unconed/fuse10,2013-09-19T04:27:48Z,[],front end for acko net 
2880591,1377,30,7,10,247,{'javascript': 93089},User,https://api.github.com/repos/tblobaum/mongoose-troop,2013-03-13T23:03:37Z,[],plugins for your mongoose schemas
8323759,243,112,39,31,247,"{'javascript': 13830, 'php': 38584}",User,https://api.github.com/repos/StanScates/Tweet.js-Mod,2013-07-11T19:47:46Z,[],basic wrapper for seaofclouds and tweet js that incorporates functionality with twitter s v  api
2303340,1592,84,53,20,246,{'php': 205839},User,https://api.github.com/repos/jasonlewis/basset,2013-11-06T08:17:47Z,[],a better asset management package for laravel
7535778,549,100,7,33,246,{'java': 17001},User,https://api.github.com/repos/dmitry-zaitsev/CircleLayout,2013-08-15T19:17:33Z,[],circular layout for android
12096559,2580,48,1,20,246,"{'groovy': 1032, 'java': 300299, 'shell': 7394}",User,https://api.github.com/repos/ankurkotwal/making-apps-beautiful,2013-08-14T01:16:53Z,[],companion source code for sample app to go with the android dev bytes series making apps beautiful at http and and www youtube com and watch v ppyrnyuxqc
1246024,137766,44,0,38,246,"{'javascript': 771235, 'python': 8759, 'ruby': 490511, 'shell': 1850}",Organization,https://api.github.com/repos/Vizzuality/cartodb,2013-03-01T14:39:21Z,[],geospatial database for the cloud deprecated
2434586,928,42,8,34,246,"{'c': 571, 'go': 59555, 'shell': 225}",User,https://api.github.com/repos/AllenDang/gform,2013-08-30T05:10:17Z,[],windows gui framework for go
3773,23544,94,6,10,246,"{'javascript': 90942, 'perl': 2227, 'ruby': 614515, 'shell': 2246}",User,https://api.github.com/repos/tslocke/hobo,2013-03-16T16:48:24Z,[],moved the official repo is now hobo and hobo
9867430,153,35,3,18,246,{'objective-c': 26753},User,https://api.github.com/repos/kronik/SpiralPullToRefresh,2013-11-03T03:10:27Z,[],twitter music like pull to refresh controller but a bit more enhanced and flexible
14274941,3576,40,0,14,246,{'objective-c': 17711},User,https://api.github.com/repos/jackylimel/UIDynamicExample,2013-11-19T10:18:26Z,[],examples of uidynamic behaviour of ios
8827770,2184,29,2,20,245,"{'objective-c': 18630, 'ruby': 829}",User,https://api.github.com/repos/kenshin03/RouletteWheelCollectionViewDemo,2013-12-22T07:51:16Z,[],demo of a custom uicollectionviewflowlayout subclass implementation of a roulette wheel of in the style of the yahoo timetraveler app
3240598,12072,14,6,19,245,"{'c': 300646, 'javascript': 2198547, 'python': 2116}",User,https://api.github.com/repos/fbuchinger/rawson.js,2013-03-11T07:28:07Z,[],rawson js is a camera raw previewer in pure javascript
4605917,286,4,4,4,245,{'ruby': 17980},User,https://api.github.com/repos/archan937/ruby-mass,2013-01-30T10:08:30Z,[],introspect the ruby heap by locating references to and detaching in order to release objects optionally narrowing by namespace
10978068,142,100,6,34,245,"{'c++': 14708, 'objective-c': 55945, 'shell': 91}",Organization,https://api.github.com/repos/OpenWatch/H264-RTSP-Server-iOS,2013-06-26T20:16:54Z,[],unofficial mirror of hardware video encoding on iphone rtsp server example
2769302,2320,19,4,7,245,"{'c': 63910, 'c++': 389, 'objective-c': 259630, 'python': 33667, 'ruby': 5917, 'shell': 1423}",Organization,https://api.github.com/repos/fadingred/Greenwich,2013-03-27T18:30:25Z,[],a cocoa framework for localization
4735066,20692,32,3,27,244,"{'c': 355166, 'c++': 9064, 'python': 54880, 'shell': 896}",Organization,https://api.github.com/repos/guokr/gkseg,2013-01-19T05:18:58Z,[],yet another chinese word segmentation package based on character based tagging heuristics and crf algorithm
5185488,132,85,0,28,244,{'objective-c': 52233},Organization,https://api.github.com/repos/nothingmagical/cheddarkit,2013-09-02T15:50:02Z,[],objective c framework that powers cheddar for ios and cheddar for mac
312852,55458,74,32,7,244,"{'c#': 17451, 'ruby': 218167}",User,https://api.github.com/repos/derickbailey/Albacore,2013-02-11T20:59:32Z,[],dolphin safe rake tasks for net systems
4568688,370,25,0,11,244,{'python': 46029},User,https://api.github.com/repos/rspivak/csdesign,2013-06-12T02:44:54Z,[],simple examples of concurrent server design in python
384669,1756,40,2,20,244,"{'groovy': 2760, 'javascript': 80462}",User,https://api.github.com/repos/iamnoah/writeCapture,2013-06-06T02:36:54Z,[],utility to assist the ajax loading of html containing script tags that use document write mailing list http and and groups google com and group and writecapturejs users
8101491,174,64,0,23,244,{'php': 64734},User,https://api.github.com/repos/akuzemchak/laracon-todo-api,2013-05-03T00:43:54Z,[],demo api built on laravel  for my laracon  presentation
12287957,11706,243,3,69,243,"{'css': 38294, 'java': 67454}",User,https://api.github.com/repos/zhiyuncloud/aixuexiao,2013-10-31T09:57:38Z,[],sae java spring and springmvc and mybatis  http and and aixuexiao sinaapp com
12071584,29267,88,5,24,243,"{'c++': 292, 'objective-c': 1500445, 'python': 7061, 'ruby': 538}",Organization,https://api.github.com/repos/Ink/ThatCloud,2013-09-08T17:17:56Z,[],thatcloud is an open source ios application that allows you to and work with all of the content you have online
520,651,37,5,3,243,{'ruby': 36443},User,https://api.github.com/repos/DocSavage/rails-authorization-plugin,2013-03-29T18:07:36Z,[],this plugin provides a flexible way to add authorization to rails
1710651,91189,44,6,22,242,{'actionscript': 375815},User,https://api.github.com/repos/photonstorm/Flixel-Power-Tools,2013-11-28T02:35:08Z,[],the flixel power tools are a set of plug ins for flixel   and to assist with your game development
9228265,10144,103,0,23,242,"{'assembly': 53145, 'c': 11590568, 'c++': 19711996, 'objective-c': 954076, 'shell': 2628}",User,https://api.github.com/repos/grayj/Jedi-Academy,2013-04-04T21:37:28Z,[],star wars jedi knight jedi academy
11389331,1758,35,7,13,241,{'objective-c': 24616},Organization,https://api.github.com/repos/SureCase/WaterfallCollectionView,2013-11-11T17:16:33Z,[],waterfall style implementation of uicollectionview layout
1210831,2416,50,0,20,241,"{'javascript': 548938, 'perl': 7035, 'php': 613, 'shell': 1449}",User,https://api.github.com/repos/zeljkoprsa/Magento-Boilerplate,2013-05-19T12:29:26Z,[],magento theme package based on html bolierplate by paul irish coupled with csspie by  creative llc
7849940,6358,92,142,38,241,{'java': 1486934},User,https://api.github.com/repos/gggard/AndroidCaldavSyncAdapater,2013-11-20T17:12:38Z,[],caldav synch adapter for android
1450564,41000,146,0,27,241,"{'c': 710162, 'c++': 8309518, 'java': 52902, 'objective-c': 17708, 'python': 31247, 'shell': 3139}",User,https://api.github.com/repos/vigsterkr/libjingle,2013-02-23T10:21:14Z,[],libjingle clone of the original svn with some local patches
8251418,595,24,1,14,241,"{'objective-c': 24626, 'ruby': 1063}",User,https://api.github.com/repos/blork/SJOPaperboy,2013-10-28T00:44:47Z,[],an easy to use library that lets you implement background updates in your app that run whenever the user enters or exits a specified location
2808275,1230,52,1,21,241,{'objective-c': 54307},User,https://api.github.com/repos/gooichi/foursquare-ios-api,2013-11-18T02:02:36Z,[],foursquare api v for ios
2127316,416,50,5,12,241,{'javascript': 48388},User,https://api.github.com/repos/bgaff/vnc.js,2013-07-27T02:43:05Z,[],a javascript vnc client
2422681,10232,33,21,25,240,"{'css': 120813, 'javascript': 670733, 'ruby': 2104}",User,https://api.github.com/repos/jinroh/kadoh,2013-12-08T19:48:45Z,[],the kademlia dht in javascript for node js and browsers
7143131,568,29,5,18,240,"{'javascript': 8487, 'php': 419}",User,https://api.github.com/repos/chengyin/albumcolors,2013-02-19T14:01:00Z,[],a javascript script to create a  color palette based on an image inspired by itunes 
3760843,704,25,1,15,240,"{'c': 97357, 'objective-c': 414427, 'perl': 687}",User,https://api.github.com/repos/ocrickard/OCPDFGen,2013-02-27T00:18:51Z,[],pdf from html generation library for ios
611251,516,19,6,12,240,{'python': 44842},User,https://api.github.com/repos/eyeseast/python-tablefu,2013-09-06T02:28:49Z,[],a python version almost a port of propublica s tablefu
4352575,391,42,1,10,240,{'objective-c': 52410},User,https://api.github.com/repos/cocopon/CQMFloatingController,2013-07-13T04:34:35Z,[],floating ui component with navigation bar for iphone
8691504,143,31,1,5,239,{'python': 3794},User,https://api.github.com/repos/kljensen/async-flask-sqlalchemy-example,2013-03-11T19:43:35Z,[],non blocking gevent gunicorn example
14510206,7611,103,2,26,239,"{'javascript': 30209214, 'php': 261}",Organization,https://api.github.com/repos/tinyspeck/glitch-GameServerJS,2013-12-11T21:58:30Z,[],the server side javascript for glitch that determined all game behavior
6006459,453,10,1,19,239,"{'objective-c': 27956, 'ruby': 1230}",User,https://api.github.com/repos/jnjosh/JJAFAcceleratedDownloadRequestOperation,2013-01-20T04:24:14Z,[],a delightful extension to the delightful afnetworking to provide accelerated and resumable downloads
978894,140,45,2,16,239,"{'javascript': 2223, 'objective-c': 5250}",User,https://api.github.com/repos/ochameau/NativeBridge,2013-02-08T23:47:02Z,[],proper way to call objetive c from javascript in uiwebview
3151061,9591,61,23,163,238,"{'c': 295387, 'c++': 15046, 'd': 15680, 'java': 599564}",Organization,https://api.github.com/repos/couchbaselabs/TouchDB-Android,2013-05-14T22:02:10Z,[],couchdb compatible mobile database android version
3965305,1795,16,4,27,237,"{'php': 487849, 'python': 283501, 'shell': 34}",User,https://api.github.com/repos/runekaagaard/snowscript,2013-12-10T15:05:46Z,[],a language that compiles to php
9394283,154,95,10,24,237,{'java': 155127},User,https://api.github.com/repos/faucamp/SimpleRtmp,2013-04-15T09:33:02Z,[],simplertmp is a simple java library for implementing rtmp with no external dependencies or nio
476414,241,32,0,3,237,"{'javascript': 10824, 'scala': 123}",User,https://api.github.com/repos/felixge/node-paperboy,2013-08-02T16:05:07Z,[],a node js module for delivering static files
7437202,148,14,0,20,237,{'ruby': 8184},User,https://api.github.com/repos/kpshek/mm2pwd,2013-01-08T11:04:14Z,[],mega man  password generator
15218510,287,12,0,13,236,"{'python': 179677, 'shell': 5179}",User,https://api.github.com/repos/voidfiles/lark,2013-12-28T09:20:46Z,[],lark is a resty interface for redis
6525647,331,13,1,20,236,{'javascript': 121887},User,https://api.github.com/repos/jackfranklin/jQuery-Form-Validator,2013-01-01T19:19:57Z,[],got bored of using other so made my own
8742936,536,19,2,18,235,{'java': 27014},User,https://api.github.com/repos/ragunathjawahar/instant-adapter,2013-12-27T05:52:33Z,[],just like instant saves  of your time on android s custom adapters
2296633,33047,129,2,42,235,"{'assembly': 1050, 'c': 3738470, 'c++': 6244, 'objective-c': 4774, 'perl': 6636, 'shell': 20390, 'xml': 5822}",User,https://api.github.com/repos/git-mirror/nginx,2013-04-24T16:00:14Z,[],a mirror of the nginx svn repository
14267587,274,25,1,26,235,{'clojure': 20971},User,https://api.github.com/repos/richhickey/harmonikit,2013-11-27T02:55:34Z,[],an additive synth for clojure and overtone
2601967,2723,76,13,14,234,"{'coffeescript': 10635, 'css': 6085, 'javascript': 46144, 'ruby': 154208}",User,https://api.github.com/repos/assaf/rack-oauth2-server,2013-09-30T17:33:53Z,[],looking for maintainer oauth   authorization server as a rack module
1688824,10063,49,7,30,234,"{'java': 274786, 'ruby': 566}",User,https://api.github.com/repos/ahmetb/orman,2013-11-09T00:58:03Z,[],lightweight and minimalist orm for java and android works with sqlite mysql not actively maintained
182356,175,60,6,13,234,{'python': 28669},User,https://api.github.com/repos/clintecker/python-googleanalytics,2013-06-02T19:38:56Z,[],a python client for accessing the google analytics api
1308593,3504,38,0,14,233,"{'c': 133211, 'objective-c': 987962, 'perl': 2122}",User,https://api.github.com/repos/odrobnik/MyAppSales,2013-01-23T09:49:17Z,[],mobile itc reports downloader and dashboard
7386592,181,205,12,28,232,{'php': 10523},User,https://api.github.com/repos/tlack/snaphax,2013-11-10T20:35:23Z,[],a php library to use the snapchat api
12129587,163,52,15,18,232,"{'css': 61623, 'javascript': 7152}",Organization,https://api.github.com/repos/yearofmoo/ngAnimate-animate.css,2013-12-12T16:46:11Z,[],a driver module to make animate css work with angularjs  
9029995,261,12,9,13,231,{'javascript': 9436},User,https://api.github.com/repos/substack/exterminate,2013-10-03T09:17:14Z,[],terminal emulator application like xterm in node and html
1766977,176,53,15,17,231,{'ruby': 25772},User,https://api.github.com/repos/recurser/jekyll-plugins,2013-08-29T22:56:46Z,[],a collection of jekyll plugins and generators that i ve written for recursive design com
4555319,316,130,4,34,231,"{'erlang': 201447, 'ruby': 3989, 'shell': 12559}",User,https://api.github.com/repos/hpyhacking/openpoker,2013-09-09T05:19:08Z,[],genesis texas hold em game server
4697004,623,26,1,20,231,{'objective-c': 4585},User,https://api.github.com/repos/carsonmcdonald/PushBackAnimation,2013-04-06T13:46:59Z,[],example animation for ios that sends one view into the background as another view slides up
9295345,210,58,13,22,231,{'javascript': 8126},User,https://api.github.com/repos/btford/angular-dragon-drop,2013-07-22T16:46:01Z,[],drag and drop for angularjs
3287703,10046,34,1,22,230,"{'objective-c': 154322, 'python': 1300, 'shell': 9131}",User,https://api.github.com/repos/sorced-jim/SPDY-for-iPhone,2013-08-07T03:55:33Z,[],a project to build a spdy client library for the iphone
11424141,6471,35,4,16,230,"{'objective-c': 19370, 'ruby': 558}",User,https://api.github.com/repos/daria-kopaliani/DARecycledScrollView,2013-08-07T13:50:40Z,[],uiscrollview subclass that reuses its tile views
208859,119,40,1,6,230,{'ruby': 15710},User,https://api.github.com/repos/danlucraft/retwis-rb,2013-07-15T09:53:19Z,[],port of redis example twitter app to ruby and sinatra
6696037,3390,20,4,35,230,"{'clojure': 71177, 'javascript': 2233}",User,https://api.github.com/repos/drcode/webfui,2013-01-30T18:40:04Z,[],client side web framework for clojurescript
868969,5006,75,2,16,230,"{'c': 927982, 'c++': 570145, 'javascript': 48214, 'matlab': 784, 'objective-c': 148105, 'perl': 11940, 'prolog': 2704, 'python': 38702, 'xml': 34918}",User,https://api.github.com/repos/benlodotcom/VRToolKit,2013-04-23T14:52:01Z,[],a complete iphone app doing some virtual reality this app uses artoolkit plus to detect markers on the video frames and then overlays d objects following the movements of this marker the code is released under gpl
3384214,163,11,8,2,229,{'javascript': 55038},User,https://api.github.com/repos/Ejhfast/TypedJS,2013-02-08T04:12:39Z,[],lightweight program specifications for testing javascript
342564,4186,47,19,18,229,{'actionscript': 302903},Organization,https://api.github.com/repos/swiz/swiz-framework,2013-06-19T04:19:12Z,[],swiz framework for as and flex
6016224,306,30,1,14,229,{'objective-c': 48580},User,https://api.github.com/repos/danielamitay/DAModularTableView,2013-05-31T18:27:39Z,[],uitableview subclass that abstracts away the ugliness involved with creating static or modular uitableviews settings and menu pages are a snap to create with damodulartableview
7484767,123,25,0,12,229,{'ruby': 1520},User,https://api.github.com/repos/jpfuentes2/a-letter-to-Augusta,2013-03-25T15:26:36Z,[],a letter to my in ruby
2541616,279,20,7,11,229,{'javascript': 79624},User,https://api.github.com/repos/wookiehangover/underscore.deferred,2013-04-05T18:37:41Z,[],jquery style deferreds for underscore
1219981,206,51,10,19,229,{'javascript': 10956},User,https://api.github.com/repos/jussi-kalliokoski/html5Preloader.js,2013-10-14T20:20:11Z,[],a javascript library to preload all kinds of be it video or with simple syntax
5597755,402,11,3,17,228,{'javascript': 2380},User,https://api.github.com/repos/azoff/node-osx-notifier,2013-12-04T23:12:06Z,[],a nodejs server for sending notifications to osx mountain lion s notification center
15209160,545,59,1,12,228,"{'css': 900, 'javascript': 867977}",User,https://api.github.com/repos/ThomasBurleson/angularjs-FlightDashboard,2013-12-27T14:27:10Z,[],promise chains with angularjs q tutorial
4936825,281,37,2,26,227,{'python': 89883},User,https://api.github.com/repos/Ttl/evolutionary-circuits,2013-01-07T14:37:27Z,[],automatically generates analog circuits using evolutionary algorithms
3793621,229,61,4,31,227,"{'javascript': 107950, 'python': 98034}",User,https://api.github.com/repos/laoqiu/pypress-tornado,2013-07-22T06:48:00Z,['tornado'],pypress rework by tornado
3412695,900,8,5,6,227,{'ruby': 27476},User,https://api.github.com/repos/seamusabshere/unix_utils,2013-07-26T01:36:05Z,[],like but provides etc
10292696,104,11,4,18,227,{'rust': 5802},User,https://api.github.com/repos/pcwalton/zero.rs,2013-10-24T00:35:17Z,[],a module for freestanding rust programs
7502565,144,118,5,18,227,"{'css': 17412, 'javascript': 38798}",User,https://api.github.com/repos/bennadel/AngularJS-Routing,2013-09-06T12:24:36Z,[],an example of how to do deep routing in an angularjs application when ngview is not enough
6054962,784,16,0,8,227,{'coffeescript': 8983},User,https://api.github.com/repos/jotux/fangle,2013-09-18T23:23:19Z,[],fangle creates interactive pages from plain text
11580738,127,12,1,10,226,{'php': 8709},User,https://api.github.com/repos/markwilson/VerbalExpressionsPhp,2013-07-24T16:37:44Z,[],easy regular expression building
8570854,221,7,0,10,226,"{'coffeescript': 568, 'javascript': 6549}",User,https://api.github.com/repos/escusado/console.meme,2013-04-21T21:21:25Z,[],one does not simply log a message
12559993,289,26,6,10,225,"{'css': 9037, 'objective-c': 87621, 'shell': 221}",User,https://api.github.com/repos/icanzilb/MTLog,2013-11-21T15:37:53Z,[],nslog replacement for coders
7566515,26192,98,2,21,225,"{'c': 9990505, 'c#': 1386095, 'c++': 7963598, 'java': 1068857, 'javascript': 2111, 'objective-c': 54859, 'perl': 237411, 'python': 138390, 'rouge': 438, 'shell': 58004}",Organization,https://api.github.com/repos/mirror/firmware-mod-kit,2013-04-17T01:15:58Z,[],http and and firmware mod kit googlecode com and svn and trunk
2664752,402,19,1,9,225,{'javascript': 102915},User,https://api.github.com/repos/ewebdev/backbone.notifier,2013-05-03T19:10:01Z,[],notifications framework for backbone js
7229343,304,14,5,17,225,{'objective-c': 46691},User,https://api.github.com/repos/stevederico/SDScaffoldKit,2013-04-28T21:36:09Z,[],scaffolding for your core data models
2033348,210,21,13,7,225,"{'c': 149, 'haskell': 30336}",User,https://api.github.com/repos/bos/pronk,2013-01-11T16:41:46Z,[],a small command line application for load testing web servers think of it as similar to httperf or only more modern and simpler to deal with
1237805,112,22,3,9,224,{'ruby': 65951},User,https://api.github.com/repos/vinibaggio/outpost,2013-09-05T18:04:57Z,[],monitor your service s availability through a clean dsl
11505912,68,65,1,10,224,{'javascript': 5269},Organization,https://api.github.com/repos/codrops/OnScrollEffectLayout,2013-07-18T15:11:31Z,[],an on scroll effect template that animates the sides of sections once they are in the viewport
6382493,4199,131,7,29,224,{'java': 22599},User,https://api.github.com/repos/adamrocker/simple-side-drawer,2013-06-03T01:33:04Z,[],simple library which enable you to add a drawer slide out navigation to your android application
916970,269,118,8,19,223,{'python': 14608},User,https://api.github.com/repos/gregghz/Watcher,2013-09-14T00:39:00Z,[],watcher is a daemon that watches specified files and folders for changes and fires commands in response to those changes it is similar to configuration uses a simpler to read yaml file instead of a plain text file it s also written in making it easier to hack
451481,903356,75,0,20,223,"{'c++': 25598, 'css': 54106, 'd': 346, 'javascript': 711744, 'objective-c': 2274575, 'python': 11006, 'shell': 631}",User,https://api.github.com/repos/djw/core-plot,2013-12-24T11:54:29Z,[],unofficial core plot mirror official version now here https and and github com and core plot and core plot
1439382,987,35,0,13,223,{'javascript': 82054},User,https://api.github.com/repos/dresende/node-orm-old,2013-04-24T22:45:29Z,[],nodejs object relational mapping
9198813,419,33,0,16,223,{'java': 5691},User,https://api.github.com/repos/JakeWharton/adjacent-fragment-pager-sample,2013-04-04T15:22:15Z,[],demonstrates how to manage two fragments where portrait displays them in a viewpager and landscape displays them side by side
8453404,2277,43,5,40,223,"{'javascript': 243440, 'perl': 938, 'php': 219636, 'shell': 1357}",User,https://api.github.com/repos/raftalks/ravel,2013-07-02T09:23:26Z,[],cms developed with laravel  php framework and angularjs
1565025,930,47,5,18,222,"{'erlang': 92975, 'perl': 19276, 'python': 1073, 'shell': 37224}",User,https://api.github.com/repos/rzezeski/try-try-try,2013-04-09T03:43:14Z,[],ryan zezeski s working blog
11758219,506,46,5,15,222,"{'coffeescript': 2153, 'css': 139183}",Organization,https://api.github.com/repos/divshot/themestrap,2013-10-21T18:28:38Z,[],a simple starter kit for constructing twitter bootstrap  and themes
6328341,14415,79,0,25,222,{'c': 6127},User,https://api.github.com/repos/kennyyu/workshop,2013-01-30T23:35:48Z,[],technical interview workshop
7717751,127,28,1,17,221,"{'c++': 1344, 'objective-c': 14767}",User,https://api.github.com/repos/landonf/libevil_patch,2013-01-20T15:46:12Z,[],an implementation of function patching for without the use of w and x pages
1434717,431,106,0,29,221,"{'c': 782341, 'c++': 6023, 'java': 16898, 'objective-c': 5778, 'shell': 109}",User,https://api.github.com/repos/yhirano/Mp3VoiceRecorderSampleForAndroid,2013-07-26T17:05:20Z,[],mp voice recorder sample for android
3973266,850,29,24,5,221,{'ruby': 88318},User,https://api.github.com/repos/drnic/appscrolls,2013-06-24T23:49:30Z,[],the app scrolls is a magical tool to generate new rails apps and modify existing rails applications coming to include your powerful magic
1611009,52535,66,44,31,221,"{'java': 2082163, 'javascript': 124105, 'shell': 8205}",Organization,https://api.github.com/repos/Mach5/supersonic,2013-02-22T15:30:34Z,[],open source web based media streamer and jukebox fork of subsonic supports aac and other streamable audio and video formats runs on gnu and linux and mac using java
15434820,143,14,1,10,221,{'python': 1335},User,https://api.github.com/repos/azac/sublime-howdoi-direct-paste,2013-12-30T07:59:31Z,[],search stackoverflow and paste code snippets without leaving sublime text
108972,797,39,0,16,220,{'objective-c': 61691},User,https://api.github.com/repos/sschroed/git-phone,2013-03-07T16:28:28Z,[],an experimental iphone app to stay connected with github on the go
11451430,178,89,3,17,219,"{'processing': 15138, 'python': 26806}",User,https://api.github.com/repos/unorthodox123/RacialDotMap,2013-08-09T15:47:42Z,[],python code for creating a dataset for a dot density map for every person in the u s color coded by race and ethnicity
642536,218,58,18,7,219,{'ruby': 41662},User,https://api.github.com/repos/jugyo/eeepub,2013-03-21T03:24:11Z,[],eeepub is a ruby epub generator
179067,1235,54,19,3,218,"{'css': 6816, 'javascript': 522, 'ruby': 113961, 'shell': 5514}",User,https://api.github.com/repos/fcoury/octopi,2013-10-30T20:04:08Z,[],a ruby interface to github api v
254184,86,20,8,9,218,{'ruby': 16020},User,https://api.github.com/repos/freels/table_migrator,2013-07-25T06:05:10Z,[],zero downtime table migrations in mysql
9276490,188,32,0,18,218,{'objective-c': 22720},User,https://api.github.com/repos/skizilkaya/SKNavigationController,2013-09-07T12:34:10Z,[],custom uinavigationcontroller
9805058,192,43,1,33,217,{'java': 7108},User,https://api.github.com/repos/mikedg1/winky,2013-11-24T19:30:20Z,[],a way to enable wink to take a photo with google glass
8284020,2102,54,8,16,217,{'javascript': 1638008},User,https://api.github.com/repos/akrennmair/libmp3lame-js,2013-10-22T21:25:25Z,[],port of libmplame to javascript using emscripten
666669,1061,33,4,13,216,{'java': 623176},User,https://api.github.com/repos/krukow/clj-ds,2013-10-24T18:53:22Z,[],clojure s data structures modified for use outside of clojure
2330389,249,12,0,5,216,{'javascript': 2243},Organization,https://api.github.com/repos/rezitech/syze,2013-06-16T17:29:46Z,[],think media queries powered by javascript
505633,20689,26,0,6,216,{'javascript': 126594},User,https://api.github.com/repos/blaine/rePublish,2013-04-15T13:22:56Z,[],pure javascript epub reader
4744047,115,26,2,17,216,{'go': 3036},Organization,https://api.github.com/repos/bitly/go-notify,2013-02-17T04:46:04Z,[],a go package to observe notable events in a decoupled fashion
