id,subjects,processed_text,language_combinations,description
1954655,"['headless', 'webkit', 'browser', 'interface']","['headless', 'webkit', 'browser', 'interface']",['c javascript python'],headless webkit browser with node js interface
2001356,"['expandable', 'module', 'titanium']","['expandable', 'module', 'titanium']",['javascript python'],expandable text area module ios titanium
143470,['tokyotyrant'],"['based', 'tokyotyrant', 'binding']",['c shell'],a c based tokyotyrant ruby binding
2281055,['backbone'],"['clone', 'backbone', 'implemented', 'angularjs']",['ruby shell'],a clone of the backbone todo app implemented with angularjs
1471323,"['hookable', 'server']","['hookable', 'server', 'using', 'libssh']",['c javascript'],a hookable ssh server for node js using libssh
1091258,['editor'],"['editor', 'android']",['c c++'],text editor for android
514093,"['canvas', 'library']","['repository', 'canvas', 'library', 'related']",['java shell'],repository for cdl canvas d js library see wiki for related links
668324,['template'],['template'],['coffeescript javascript'],javascript templates for ruby apps
261988,"['shiftspace', 'project']","['shiftspace', 'project']",['python shell'],main repo of the shiftspace project
96244,"['super', 'nintendo', 'adobe', 'flash']","['super', 'nintendo', 'adobe', 'flash']",['objective-c perl shell'],super nintendo in adobe flash
1879276,"['actor', 'graphicl', 'database']","['actor', 'using', 'reply', 'without', 'actor', 'based', 'functional', 'programming', 'keyed', 'versioned', 'graphicl', 'database']",['javascript shell'],fast actors using replies without actor based functional programming with keyed and an versioned graphicl database
1086506,"['stack', 'kinect', 'camera']","['stack', 'kinect', 'camera']",['c shell'],ros stack for kinect camera
1075197,"['convenience', 'class']","['convenience', 'class', 'appletv']",['c shell'],conveniences classes from appletv
2557253,"['collection', 'stanford', 'online', 'introduction', 'artificial', 'intelligence', 'class']","['collection', 'stanford', 'online', 'introduction', 'artificial', 'intelligence', 'class']",['javascript python'],code collection for the stanford online introduction to artificial intelligence class
