id,subjects,processed_text,language_combinations,description
1295583,"['framework', 'customizable', 'content', 'range', 'mobile', 'device', 'strength', 'customizable', 'system', 'adapt', 'content', 'mobile', 'device', 'early', 'generation', 'smart', 'modern', 'device']","['kurogo', 'framework', 'delivering', 'driven', 'customizable', 'content', 'range', 'mobile', 'device', 'strength', 'customizable', 'system', 'allows', 'adapt', 'content', 'variety', 'source', 'easily', 'present', 'mobile', 'device', 'feature', 'early', 'generation', 'smart', 'modern', 'device', 'tablet']",['javascript shell'],kurogo is a php framework for delivering high data driven customizable content to a wide range of mobile devices its strengths lie in the customizable system that allows you to adapt content from a variety of sources and easily present that to mobile devices from feature to early generation smart to modern devices and tablets
3258474,"['primer', 'programmer']","['primer', 'programmer']",['c shell'],x assembly primer for c programmers
743502,"['graphdb', 'opensource', 'graph', 'database']","['graphdb', 'opensource', 'graph', 'database']",['javascript shell'],sones graphdb opensource graph database
6254495,"['library', 'remote', 'control', 'vibrator']","['library', 'remote', 'control', 'vibrator']",['c c++'],arduino library for remote control lelo vibrators
3598059,"['digsby', 'social', 'network']","['digsby', 'email', 'social', 'network']",['javascript objective-c shell'],digsby im and email and social networks
7321417,"['metacircular', 'interpreter']","['visualize', 'metacircular', 'interpreter']",['css javascript'],visualize your javascript with a cps metacircular interpreter
1581223,"['server', 'getwork']","['bitcoin', 'mining', 'server', 'getwork', 'based', 'obsolete']",['c++ python shell'],bitcoin mining pool server getwork based obsolete
12220065,['django'],"['django', 'using', 'docker']",['python shell'],demo django app using docker
8231348,"['communication', 'dashboard', 'support', 'multiple', 'group', 'communication', 'hashtag', 'support', 'facebook', 'profile']","['crowy', 'communication', 'dashboard', 'support', 'multiple', 'group', 'communication', 'incluging', 'twitter', 'hashtag', 'support', 'facebook', 'profile', 'cybozu', 'youroom']",['ruby shell'],crowy is a communication dashboard supports multiple group communications incluging twitter with hashtag support facebook profile and page and cybozu live and youroom
7809570,"['hadoop', 'aggregator']","['hadoop', 'aggregator', 'dashboard']",['javascript perl shell'],hadoop log aggregator and dashboard
8000868,"['framework', 'social', 'network', 'account']","['socialaccounts', 'framework', 'provides', 'manage', 'social', 'network', 'account']",['perl ruby'],socialaccounts is an ios framework that provides an easy way to manage social network accounts
1424730,"['callback', 'kepler', 'pollen', 'planet']","['clean', 'callback', 'enabled', 'formerly', 'known', 'kepler', 'pollen', 'planet']",['c objective-c shell'],the all new clean and ui callback enabled app formerly known as kepler aka pollen planets
2431023,"['centric', 'vimfiles']","['centric', 'vimfiles', 'support']",['ruby shell'],ruby and rails centric vimfiles with support for rvm and more
8629497,"['miner', 'official', 'source']","['miner', 'official', 'source']",['c++ objective-c shell'],miner wars official source codes
14835020,[],['sleepy'],['css javascript'],python orm and odm for the sleepy
7865360,"['intel', 'software', 'occlusion']","['intel', 'software', 'occlusion', 'culling', 'modification']",['c objective-c shell'],intel s software occlusion culling demo with my modifications
1470507,"['flask', 'skeleton', 'google', 'boilerplate']","['flask', 'skeleton', 'google', 'using', 'boilerplate', 'templating']",['c javascript'],a flask skeleton for google app using html boilerplate templating
3119164,"['software', 'transactional', 'memory', 'implementation']","['software', 'transactional', 'memory', 'implementation']",['css shell'],software transactional memory implementation for the jvm
13228666,['toolbox'],"['contains', 'toolbox']",['c++ objective-c'],contains all my matlab toolboxes
2101247,"['driver', 'virtio', 'network', 'device', 'virtio', 'network', 'device', 'virtual', 'network', 'device', 'virtualbox']","['driver', 'virtualised', 'virtio', 'network', 'device', 'virtio', 'network', 'device', 'supported', 'virtualbox', 'fastest', 'virtual', 'network', 'device', 'virtualbox', 'allows', 'kernel', 'debugging', 'guest']",['c shell'],mac os x driver for a virtualised virtio network device virtio network devices are supported by kvm and virtualbox fastest virtual network device for virtualbox osx allows kernel debugging of guests via gdb
4146761,"['friendly', 'backend']","['written', 'friendly', 'backend']",['ruby shell'],a node js cms written in with a user friendly backend
4131496,"['framwork', 'mobile']","['framwork', 'building', 'mobile']",['css ruby'],html ui framwork for building mobile apps
2292854,"['chart', 'library']","['iphone', 'chart', 'library']",['c c++'],iphone and ipad chart library
1596377,"['source', 'server', 'static', 'content']","['shortfin', 'lightweight', 'source', 'server', 'static', 'content']",['c++ objective-c shell'],shortfin is a very fast and lightweight open source web server that serves static content only
4198297,"['chromium', 'project']","['experiment', 'contribution', 'chromium', 'project']",['perl python shell'],experiments and contributions to chromium project
6193567,"['experimental', 'unifont']","['experimental', 'based', 'terminal', 'unifont', 'rendering', 'using', 'libvterm']",['c++ objective-c shell'],experimental sdl based terminal with gnu unifont font rendering using libvterm
3885673,['sample'],"['sample', 'programming', 'pushing', 'limit']",['c++ perl'],sample code from ios programming pushing the limits
1884096,"['initial', 'concept', 'phpspec']","['first', 'alpha', 'initial', 'concept', 'phpspec', 'moved', 'phpspec', 'phpspec']",['javascript ruby'],first alpha and initial concept of phpspec moved to phpspec and phpspec repo
3930334,"['application', 'rocketship']","['single', 'application', 'rocketship']",['css javascript'],single page application rocketship
14458190,"['technical', 'candidate']","['interviewing', 'technical', 'candidate', 'browser']",['css javascript'],web app for interviewing technical candidates in the browser
5995366,"['standalone', 'command', 'compatible']","['standalone', 'running', 'command', 'compatible', 'ocunit']",['ruby shell'],a standalone tool for running your ios unit tests from the command line compatible with ocunit and kiwi ios unit tests
37011,['organisation'],"['organisation', 'written', 'inspired', 'backpack']",['css javascript'],organisation tool written in rails inspired by backpack
1493284,"['junkyard', 'jumbotron', 'random', 'display', 'large', 'virtual', 'display', 'browser']","['junkyard', 'jumbotron', 'really', 'combine', 'bunch', 'random', 'display', 'large', 'virtual', 'display', 'smartphones', 'anything', 'browser', 'magic', 'configure', 'photograph', 'screen']",['perl python shell'],the junkyard jumbotron is a web tool that makes it really easy to combine a bunch of random displays into a large virtual display it works with smartphones anything that can run a web browser and the magic is that all you need to do to configure one is take a photograph of all the screens
574205,['software'],"['software', 'written']",['perl shell'],sip software written in erlang
1538255,"['brisk', 'distribution']","['datastax', 'brisk', 'distribution']",['javascript python shell'],datastax brisk distribution
7007153,"['virtual', 'universe', 'browser']","['virtual', 'universe', 'browser']",['css javascript'],a virtual d universe in your web browser
8293120,"['collection', 'utility', 'library']","['moost', 'collection', 'utility', 'library']",['objective-c python'],moost last fm s collection of c and and utility libraries
14878542,"['source', 'virtual', 'machine']","['source', 'virtual', 'machine']",['javascript python shell'],source code for the actionscript virtual machine
969036,"['manycore', 'virtual', 'machine']","['roarvm', 'manycore', 'virtual', 'machine']",['javascript objective-c shell'],roarvm is a manycore smalltalk virtual machine
21417,"['benchmark', 'implementation']","['benchmark', 'testing', 'implementation']",['javascript perl shell'],a set of ruby benchmarks for testing ruby implementations
14743998,['engine'],"['engine', 'binding', 'golang']",['c++ javascript shell'],v javascript engine binding for golang
488456,"['level', 'utility', 'level', 'engine']","['webglu', 'level', 'utility', 'level', 'engine', 'developing', 'webgl', 'based', 'application']",['python shell'],webglu is both a set of low level utilities and a high level engine for developing webgl based applications
2580088,"['sandbox', 'library', 'libsandbox', 'pysandbox', 'source', 'suite', 'software', 'component', 'developer', 'watchdog', 'program', 'simple', 'single', 'process', 'behavioral', 'resource']","['sandbox', 'library', 'libsandbox', 'pysandbox', 'source', 'suite', 'software', 'component', 'developer', 'create', 'automated', 'profiling', 'watchdog', 'program', 'designed', 'executing', 'instrumenting', 'simple', 'single', 'process', 'featuring', 'policy', 'based', 'behavioral', 'resource', 'statistic', 'collecting']",['python shell'],the sandbox libraries libsandbox pysandbox are an open source suite of software components for c and c and and and python developers to create automated profiling tools and watchdog programs the api s are designed for executing and instrumenting simple single process featuring policy based behavioral resource and statistics collecting
5241965,"['example', 'application', 'jquery', 'fileupload', 'paperclip', 'upload']","['example', 'application', 'jquery', 'fileupload', 'paperclip', 'upload']",['coffeescript javascript'],an example rails application that uses the jquery fileupload rails and paperclip gems to upload files
2934564,"['engine', 'kneath', 'documentation']","['engine', 'kneath', 'documentation']",['css ruby'],a rails engine for kneath s kss documentation
9228529,"['knight', 'outcast']","['knight', 'outcast']",['c objective-c shell'],star wars jedi knight ii jedi outcast
5269375,"['underscore', 'objective']","['underscore', 'objective']",['c ruby'],m is a port of underscore js to objective c
1753142,"['online', 'reader']","['online', 'reader', 'written']",['perl python shell'],an online rss reader written in clojure javascript java
547593,"['performance', 'store']","['based', 'performance', 'store']",['php shell'],a hash based high performance data store
1507091,"['mysql', 'database', 'binding']","['mysql', 'database', 'binding']",['javascript python'],mysql database bindings for node js
6429603,['vimside'],"['vimside', 'built', 'ensime']",['java shell'],vim scala ide vimside built upon ensime
8297160,['website'],"['scrolling', 'single', 'website']",['css ruby'],scrolling for single page websites
1941656,['support'],"['support', 'binding', 'virtually', 'object']",['css ruby'],hooks to support data binding between virtually any object
7972514,"['template', 'durandal']","['template', 'durandal']",['javascript shell'],john papa s asp net mvc spa template durandal
10002690,"['experimental', 'framework', 'multiplayer']","['experimental', 'framework', 'multiplayer']",['objective-c python'],an experimental framework for low high fps multiplayer games
2731990,"['bootstrap', 'heroku', 'simple', 'sinatra', 'server']","['bootstrap', 'heroku', 'easily', 'customizable', 'marketing', 'landing', 'integrates', 'mailchimp', 'simple', 'sinatra', 'server']",['javascript ruby'],bootstrap heroku easily customizable marketing landing page that integrates with mailchimp simple sinatra server app
7401172,"['quartz', 'composer', 'webgl', 'compiler']","['quartz', 'composer', 'webgl', 'compiler']",['python ruby'],quartz composer to js and webgl compiler
2596695,['mystory'],['mystory'],['javascript perl shell'],qq demo http and and mystory cc and
